{
  "id": "company-baseline",
  "version": "3.1.0",
  "scope": "company",
  "required_gates": [
    "build",
    "unit",
    "secret_scan",
    "policy_integrity",
    "baseline_freshness",
    "boundary"
  ],
  "capability_gates": [
    {"gate_id": "coverage", "capability_key": "quality.coverage", "producer_kind": "pipeline_job"},
    {"gate_id": "lint_typecheck", "capability_key": "quality.lint", "producer_kind": "pipeline_job"},
    {"gate_id": "license", "capability_key": "supply-chain.license", "producer_kind": "pipeline_job"},
    {"gate_id": "sast", "capability_key": "security.sast", "producer_kind": "pipeline_job"},
    {"gate_id": "dependency", "capability_key": "supply-chain.dependency", "producer_kind": "pipeline_job"},
    {"gate_id": "image", "capability_key": "supply-chain.image", "producer_kind": "pipeline_job"},
    {"gate_id": "integration", "capability_key": "integration.enabled", "producer_kind": "pipeline_job"},
    {"gate_id": "contract", "capability_key": "contract.openapi", "producer_kind": "pipeline_job"}
  ],
  "coverage": {
    "changed_lines_min_percent": 80,
    "max_total_drop_points": 0.5
  },
  "security": {
    "block_severities": ["critical", "high"],
    "license_denylist": ["AGPL-3.0-only", "AGPL-3.0-or-later"]
  },
  "flaky_retry_count": 1,
  "waiver": {
    "max_days": 7,
    "requires_distinct_approver": true,
    "non_waivable_gates": [
      "identity_isolation",
      "sha_integrity",
      "policy_integrity",
      "webhook_authenticity"
    ]
  }
}
